{
  "artifact": "bench/corpus/accessibility/accessibility-003.html",
  "artifact_sha256": "7c6c5768dd9212f5e7568794522e3988cc0d2d07cd7c082f86a60615e3174fac",
  "artifact_type": "html",
  "defects": [
    {
      "criterion": "WCAG-4.1.2",
      "description": "A custom interactive control loses its role, its accessible name, and its keyboard handling, leaving only a bare, unlabeled element.",
      "location": {
        "element_id": "s3-customcontrol",
        "kind": "element-id",
        "text": "the element, id `s3-customcontrol`"
      },
      "severity_expected": 3
    },
    {
      "criterion": "WCAG-1.3.2",
      "description": "A multi-step sequence's document order is scrambled while a CSS order override restores the original visual appearance, so a linearized reading no longer follows the task order a sighted layout still shows.",
      "location": {
        "element_id": "s3-wizard",
        "kind": "element-id",
        "text": "the element, id `s3-wizard`"
      },
      "severity_expected": 3
    },
    {
      "criterion": "WCAG-1.4.1",
      "description": "A required field's label loses its text indicator and is recolored, leaving color as the only signal that the field is required.",
      "location": {
        "element_id": "s3-form-phone-label",
        "kind": "element-id",
        "text": "the label, id `s3-form-phone-label`"
      },
      "severity_expected": 2
    },
    {
      "criterion": "WCAG-3.3.1",
      "description": "An invalid field's error text is replaced with a generic word that names neither the field nor the specific problem.",
      "location": {
        "element_id": "s3-form-promo-error",
        "kind": "element-id",
        "text": "the element, id `s3-form-promo-error`"
      },
      "severity_expected": 2
    }
  ],
  "domain": "accessibility",
  "manifest_version": "1.0.0",
  "recipe": "accessibility-003",
  "seed": "5464c431048cca3ee636fffff14e3ef2"
}
