{
  "artifact": "bench/corpus/argument/argument-002.md",
  "artifact_sha256": "0322bc2ebeb48318c56473186a8cb1f1e78d8667b99cfaf75ee7bb84f82fcfa2",
  "artifact_type": "markdown-prose",
  "defects": [
    {
      "criterion": "TOULMIN-CLAIM-MARKER",
      "description": "The leading conclusion-signalling clause was removed from the sentence stating the recommendation, and no phrase from the marker lexicon appears anywhere else in the document.",
      "location": {
        "heading_path": [
          "Ending Overdue Fines Systemwide: A Recommendation"
        ],
        "kind": "heading-path",
        "text": "the whole document, under its \"Ending Overdue Fines Systemwide: A Recommendation\" heading"
      },
      "severity_expected": 3
    },
    {
      "criterion": "TOULMIN-HEDGE-DENSITY",
      "description": "A hedging clause was inserted at the start of every sentence in every paragraph of the document, raising the hedged-sentence ratio well past the threshold.",
      "location": {
        "heading_path": [
          "Ending Overdue Fines Systemwide: A Recommendation"
        ],
        "kind": "heading-path",
        "text": "the whole document, under its \"Ending Overdue Fines Systemwide: A Recommendation\" heading"
      },
      "severity_expected": 3
    },
    {
      "criterion": "TOULMIN-GROUNDS",
      "description": "The paragraph offering checkable pilot evidence was replaced with a restatement of the recommendation in different words.",
      "location": {
        "heading_path": [
          "Ending Overdue Fines Systemwide: A Recommendation",
          "What the Pilot Showed"
        ],
        "kind": "paragraph",
        "paragraph": 3,
        "text": "What the Pilot Showed, first paragraph"
      },
      "severity_expected": 2
    },
    {
      "criterion": "TOULMIN-CLAIM",
      "description": "The specific, checkable recommendation sentence was replaced with a generic statement broad enough that no reader could disagree with it.",
      "location": {
        "heading_path": [
          "Ending Overdue Fines Systemwide: A Recommendation",
          "Recommendation"
        ],
        "kind": "paragraph",
        "paragraph": 6,
        "text": "Recommendation, second paragraph"
      },
      "severity_expected": 3
    },
    {
      "criterion": "TOULMIN-QUALIFIER",
      "description": "The sentence bounding the recommendation to the evidence's actual scope was replaced with an unqualified absolute claim the evidence does not support.",
      "location": {
        "heading_path": [
          "Ending Overdue Fines Systemwide: A Recommendation",
          "Recommendation"
        ],
        "kind": "paragraph",
        "paragraph": 7,
        "text": "Recommendation, third paragraph"
      },
      "severity_expected": 3
    }
  ],
  "domain": "argument",
  "manifest_version": "1.0.0",
  "recipe": "argument-002",
  "seed": "90ee0ce71e2de730b3c6bc55128f6343"
}
