{
  "artifact": "bench/corpus/clarity/clarity-002.md",
  "artifact_sha256": "7fd910197f585ef10416cde2ed6b94fa48de539377a1082d82e29ccee509e6df",
  "artifact_type": "markdown-prose",
  "defects": [
    {
      "criterion": "PLAIN-PARAGRAPH",
      "description": "The paragraph runs well past the length threshold with no intervening break.",
      "location": {
        "heading_path": [
          "Home-Office Equipment Stipend Policy",
          "Eligibility"
        ],
        "kind": "paragraph",
        "paragraph": 5,
        "text": "Eligibility, third paragraph"
      },
      "severity_expected": 2
    },
    {
      "criterion": "PLAIN-LISTS",
      "description": "A sentence embeds three comma-separated parallel items inline rather than presenting them as a formatted list.",
      "location": {
        "heading_path": [
          "Home-Office Equipment Stipend Policy",
          "How to Apply"
        ],
        "kind": "paragraph",
        "paragraph": 6,
        "text": "How to Apply, first paragraph"
      },
      "severity_expected": 2
    },
    {
      "criterion": "PLAIN-MUST",
      "description": "One binding requirement is stated in a non-mandatory register in a document that otherwise states requirements plainly.",
      "location": {
        "heading_path": [
          "Home-Office Equipment Stipend Policy",
          "Required Documentation"
        ],
        "kind": "paragraph",
        "paragraph": 12,
        "text": "Required Documentation, second paragraph"
      },
      "severity_expected": 2
    },
    {
      "criterion": "PLAIN-NOMINALIZATION",
      "description": "The action is buried inside a nominalized noun carried by a generic support verb, instead of stated as the sentence's own main verb.",
      "location": {
        "heading_path": [
          "Home-Office Equipment Stipend Policy",
          "Reimbursement Amounts"
        ],
        "kind": "paragraph",
        "paragraph": 13,
        "text": "Reimbursement Amounts, first paragraph"
      },
      "severity_expected": 2
    },
    {
      "criterion": "PLAIN-PRONOUNS",
      "description": "The reader and the writer's organization are routed through third-person institutional substitutes instead of direct address.",
      "location": {
        "heading_path": [
          "Home-Office Equipment Stipend Policy",
          "Restrictions and Exceptions"
        ],
        "kind": "paragraph",
        "paragraph": 15,
        "text": "Restrictions and Exceptions, first paragraph"
      },
      "severity_expected": 2
    },
    {
      "criterion": "WILLIAMS-SHAPE",
      "description": "A long sentence stacks subordinate-clause markers between its subject and its main verb instead of holding the main clause together.",
      "location": {
        "heading_path": [
          "Home-Office Equipment Stipend Policy",
          "Restrictions and Exceptions"
        ],
        "kind": "paragraph",
        "paragraph": 16,
        "text": "Restrictions and Exceptions, second paragraph"
      },
      "severity_expected": 3
    },
    {
      "criterion": "WILLIAMS-CHARACTER-ACTION",
      "description": "Every sentence in the passage runs its action through an abstract noun as subject instead of naming the real-world actor responsible for it.",
      "location": {
        "heading_path": [
          "Home-Office Equipment Stipend Policy",
          "Review Responsibility"
        ],
        "kind": "paragraph",
        "paragraph": 22,
        "text": "Review Responsibility, first paragraph"
      },
      "severity_expected": 3
    }
  ],
  "domain": "clarity",
  "manifest_version": "1.0.0",
  "recipe": "clarity-002",
  "seed": "d106aa487961db51ba9a7944d7cee161"
}
