{
  "artifact": "bench/corpus/docs/docs-002.md",
  "artifact_sha256": "25c4dd0ebb76ed338a3330329de0387044967be4fa65c3db44b1e3042d579c91",
  "artifact_type": "markdown-tree",
  "defects": [
    {
      "criterion": "DIATAXIS-HEADING-DEPTH",
      "description": "A heading inserted two levels below the heading immediately before it in document order, with no intermediate level between them.",
      "location": {
        "heading_path": [
          "Send your first test alert",
          "Open the test console",
          "Check the sidebar updated"
        ],
        "kind": "heading-path",
        "text": "the Check the sidebar updated heading"
      },
      "severity_expected": 2
    },
    {
      "criterion": "DIATAXIS-TUTORIAL-ACTION",
      "description": "One paragraph added pausing the step sequence for a short aside on why the tool behaves this way, before the sequence resumes.",
      "location": {
        "heading_path": [
          "Send your first test alert",
          "Trigger the sample alert"
        ],
        "kind": "paragraph",
        "paragraph": 5,
        "text": "Trigger the sample alert, second paragraph"
      },
      "severity_expected": 2
    }
  ],
  "domain": "docs",
  "manifest_version": "1.0.0",
  "recipe": "docs-002",
  "seed": "4793ddb2b273073c5a84187cea526e36"
}
