{
  "artifact": "bench/corpus/microcopy/microcopy-003.md",
  "artifact_sha256": "e9b64055b86fe1ab966f96bb9fe0f79445ede21bc0c18a28c6c9326aaa325f59",
  "artifact_type": "markdown-prose",
  "defects": [
    {
      "criterion": "NNG-EM-CONSTRUCTIVE",
      "description": "The Message text was replaced with a statement that names the problem and offers no imperative instruction or named next step anywhere in it.",
      "location": {
        "heading_path": [
          "Screens Under Review",
          "Search results, no matches"
        ],
        "kind": "paragraph",
        "paragraph": 1,
        "text": "Search results, no matches, message 1"
      },
      "severity_expected": 3
    },
    {
      "criterion": "NNG-EM-SALIENT",
      "description": "The Signal field's visual-weight description was replaced with a variant describing the message as indistinguishable from surrounding page content.",
      "location": {
        "heading_path": [
          "Screens Under Review",
          "Search results, no matches"
        ],
        "kind": "paragraph",
        "paragraph": 2,
        "text": "Search results, no matches, message 2"
      },
      "severity_expected": 3
    }
  ],
  "domain": "microcopy",
  "manifest_version": "1.0.0",
  "recipe": "microcopy-003",
  "seed": "41d6e401f80b2f4f38a9b2d4f5571dec"
}
